ID,Person,Organization,Title,Start,End
5633,Đỗ Văn Chiến,,"Ủy viên Ban Thường vụ Tỉnh ủy, Bí thư Huyện ủy, Chủ tịch HĐND huyện Yên Sơn, tỉnh Tuyên Quang",3/1998,7/2001
5634,Đỗ Văn Chiến,,"Ủy viên Ban Thường vụ Tỉnh ủy, Phó Chủ tịch rồi Phó Chủ tịch Thường trực UBND tỉnh Tuyên Quang",8/2001,6/2009
5635,Đỗ Văn Chiến,,Tại Đại hội đại biểu toàn quốc lần thứ X của Đảng được bầu làm Ủy viên dự khuyết Ban Chấp hành Trung ương Đảng,,
5636,Đỗ Văn Chiến,,"Ủy viên dự khuyết Trung ương Đảng, Phó Bí thư Tỉnh ủy, Chủ tịch UBND tỉnh Tuyên Quang",6/2009,7/2011
5637,Đỗ Văn Chiến,,"Tại Đại hội đại biểu toàn quốc lần thứ XI của Đảng được bầu vào Ban Chấp hành Trung ương Đảng, đại biểu Quốc hội khóa XIII",,
5638,Đỗ Văn Chiến,,"Ủy viên Trung ương Đảng, Bí thư Tỉnh ủy Yên Bái; Đại biểu Quốc hội khóa XIII",8/2011,2/2015
5639,Đỗ Văn Chiến,,"Ủy viên Trung ương Đảng, Ủy viên Ban Cán sự Đảng, Thứ trưởng, Phó Chủ nhiệm Ủy ban Dân tộc; Đại biểu Quốc hội khóa XIII",02/2015,4/2016
5640,Đỗ Văn Chiến,,Tại Đại hội đại biểu toàn quốc lần thứ XII cuả Đảng được bầu vào Ban Chấp hành Trung ương Đảng,,
5641,Đỗ Văn Chiến,,"Ủy viên Trung ương Đảng, Bộ trưởng, Chủ nhiệm Ủy ban Dân tộc, Đại biểu Quốc hội khóa XIV",4/2016,2021
5642,Đỗ Văn Chiến,,"07/4/2021: Tại kỳ họp thứ 11, Quốc hội khóa XIV phê chuẩn miễn nhiệm chức vụ Bộ trưởng, Chủ nhiệm Ủy ban Dân tộc",,
5685,Phạm Bình Minh,,TÓM TẮT QUÁ TRÌNH CÔNG TÁC 9/1976 - 9/1981: 10/1981 - 9/1982: Sinh viên Trường Đại học Ngoại giao tại Hà Nội,,
5686,Phạm Bình Minh,,"Cán bộ Vụ Đào tạo, Bộ Ngoại giao",,
5687,Phạm Bình Minh,,"9/1982 - 01/1986: Tùy viên, Đại sứ quán Việt Nam tại Anh",,
5688,Phạm Bình Minh,,"01/1986 - 6/1991: Cán bộ, rồi Tập sự Phó Vụ trưởng Vụ Vấn đề chung, Bộ Ngoại giao",,
5689,Phạm Bình Minh,,"6/1991 - 6/1994: Phó Vụ trưởng, Vụ Các tổ chức quốc tế, Bộ Ngoại giao; sau đó học Thạc sỹ về Luật pháp và Ngoại giao tại Đại học Fletcher, Hoa Kỳ",,
5690,Phạm Bình Minh,,"6/1994 - 7/1999: Phó Vụ trưởng, Vụ Các tổ chức quốc tế, Bộ Ngoại giao",,
5691,Phạm Bình Minh,,"8/1999 - 10/2001: Đại sứ, Phó Trưởng đại diện thường trực Việt Nam tại Liên hợp quốc, Đảng ủy viên Đảng ủy các Cơ quan đại diện Việt Nam tại Hoa Kỳ",,
5692,Phạm Bình Minh,,"10/2001 - 02/2003: Công sứ, Phó Đại sứ Việt Nam tại Hoa Kỳ, Đảng ủy viên Đảng ủy các Cơ quan đại diện Việt Nam tại Hoa Kỳ, Bí thư Chi bộ Đại sứ quán",,
5693,Phạm Bình Minh,,"3/2003 - 8/2007: Quyền Vụ trưởng rồi Vụ trưởng, Vụ Các tổ chức quốc tế, Bộ Ngoại giao",,
5694,Phạm Bình Minh,,Trưởng đoàn đối thoại về nhân quyền với các nước; Trợ lý Bộ trưởng Bộ Ngoại giao (9/2006); Ủy viên Ban Chấp hành Đảng bộ Bộ Ngoại giao,,
5695,Phạm Bình Minh,,Tại Đại hội đại biểu toàn quốc lần thứ X của Đảng được bầu làm Ủy viên dự khuyết Ban Chấp hành Trung ương Đảng,,
5696,Phạm Bình Minh,,"8/2007 - 01/2009: Ủy viên dự khuyết Trung ương Đảng, Ủy viên Ban Cán sự đảng Bộ Ngoại giao, Thứ trưởng rồi Bí thư Đảng ủy, Thứ trưởng thường trực Bộ Ngoại giao, Ủy viên Ban Chấp hành Đảng bộ khối các cơ quan Trung ương",,
5697,Phạm Bình Minh,,"01/2009 - 7/2011: Ủy viên Trung ương Đảng (chính thức), Thứ trưởng thường trực Bộ Ngoại giao",,
5698,Phạm Bình Minh,,Tại Đại hội đại biểu toàn quốc lần thứ XI của Đảng được bầu vào Ban Chấp hành Trung ương Đảng; Đại biểu Quốc hội khóa XIII,,
5699,Phạm Bình Minh,,"8/2011 - 11/2013: Ủy viên Trung ương Đảng, Bí thư Ban Cán sự đảng Bộ Ngoại giao, Bộ trưởng Bộ Ngoại giao; Ủy viên Hội đồng Quốc phòng và An ninh; Đại biểu Quốc hội khóa XIII",,
5700,Phạm Bình Minh,,"11/2013 - 01/2016: Ủy viên Trung ương Đảng, Ủy viên Ban Cán sự đảng Chính phủ, Phó Thủ tướng Chính phủ, Bí thư Ban Cán sự đảng Bộ Ngoại giao, Bộ trưởng Bộ Ngoại giao; Ủy viên Hội đồng Quốc phòng và An ninh; Đại biểu Quốc hội khóa XIII",,
5701,Phạm Bình Minh,,"Tại Đại hội đại biểu toàn quốc lần thứ XII của Đảng, được bầu lại vào Ban Chấp hành Trung ương Đảng, được Ban Chấp hành Trung ương Đảng bầu vào Bộ Chính trị",,
5702,Phạm Bình Minh,,"01/2016 - 4/2021: Ủy viên Bộ Chính trị, Ủy viên Ban Cán sự đảng Chính phủ, Phó Thủ tướng Chính phủ, Bí thư Ban Cán sự đảng Bộ Ngoại giao, Bộ trưởng Bộ Ngoại giao; Ủy viên Hội đồng Quốc phòng và An ninh; phụ trách công tác đối ngoại của Nhà nước và Đảng ủy",,
5703,Phạm Bình Minh,,"Tại Đại hội đại biểu toàn quốc lần thứ XIII của Đảng, được bầu lại vào Ban Chấp hành Trung ương Đảng và được Ban Chấp hành Trung ương Đảng bầu tái cử Bộ Chính trị khóa XIII",,
5704,Phạm Bình Minh,,"4/2021 - 01/2023: Ủy viên Bộ Chính trị (đến ngày 30/12/2022) , Phó Bí thư Ban Cán sự đảng Chính phủ (từ 20/8/2021), Phó Thủ tướng Chính phủ (ngày 6/9/2021 được phân công làm nhiệm vụ Phó Thủ tướng thường trực) ; Đại biểu Quốc hội khóa XIV, XV",,
5705,Phạm Bình Minh,,"05/01/2023: Tại Kỳ họp bất thường lần thứ 2 - Quốc hội khóa XV, Quốc hội phê chuẩn miễn nhiệm chức vụ Phó Thủ tướng Chính phủ, thôi làm nhiệm vụ Đại biểu Quốc hội khóa XV",,
5706,Phạm Bình Minh,,https://phambinhminh.chinhphu.vn/,,
5707,Phạm Bình Minh,,1,9/1976,9/1981
5708,Lê Minh Khái,,"TÓM TẮT QUÁ TRÌNH CÔNG TÁC 7/1991 - 7/1995: Cán bộ, Phó Trưởng phòng Kế toán, Liên hiệp Khoa học sản xuất In - LIKSIN, Thành phố Hồ Chí Minh",,
5709,Lê Minh Khái,,"Phó Văn phòng, Trung tâm Phát triển Ngoại thương và Đầu tư, Thành phố Hồ Chí Minh - FTDC",7/1995,3/1996
5710,Lê Minh Khái,,"Kiểm toán viên, Phó Trưởng phòng thuộc Kiểm toán Nhà nước khu vực phía Nam (tại Thành phố Hồ Chí Minh)",3/1996,3/1998
5711,Lê Minh Khái,,Trưởng phòng thuộc Kiểm toán Nhà nước khu vực phía Nam (tại Thành phố Hồ Chí Minh),3/1998,12/1999
5712,Lê Minh Khái,,"Phó Kiểm toán trưởng, Kiểm toán Nhà nước khu vực IV (tại Thành phố Hồ Chí Minh)",12/1999,7/2005
5713,Lê Minh Khái,,"Kiểm toán trưởng, Kiểm toán Nhà nước khu vực V (tại thành phố Cần Thơ)",7/2005,3/2007
5714,Lê Minh Khái,,Phó Tổng Kiểm toán Nhà nước,3/2007,3/2014
5715,Lê Minh Khái,,Phó Bí thư Tỉnh ủy Bạc Liêu,3/2014,6/2014
5716,Lê Minh Khái,,"Phó Bí thư Tỉnh ủy, Bí thư Ban Cán sự đảng, Chủ tịch Ủy ban nhân dân tỉnh Bạc Liêu",6/2014,10/2015
5717,Lê Minh Khái,,Bí thư Tỉnh ủy Bạc Liêu,10/2015,01/2016
5718,Lê Minh Khái,,"Ủy viên Trung ương Đảng, Bí thư Tỉnh ủy Bạc Liêu",01/2016,6/2016
5719,Lê Minh Khái,,"Ủy viên Trung ương Đảng, Bí thư Tỉnh ủy, Trưởng Đoàn đại biểu Quốc hội khóa XIV tỉnh Bạc Liêu",6/2016,10/2017
5720,Lê Minh Khái,,"Ủy viên Trung ương Đảng, Bí thư Ban Cán sự đảng, Tổng Thanh tra Chính phủ; Trưởng Đoàn đại biểu Quốc hội tỉnh Bạc Liêu; Ủy viên Ban Chấp hành Đảng bộ Khối các cơ quan Trung ương (5/2018); Bí thư Đảng ủy Thanh tra Chính phủ (02/2018)",10/2017,11/2018
5721,Lê Minh Khái,,"Ủy viên Trung ương Đảng, Ủy viên Ban Chấp hành Đảng bộ Khối các cơ quan Trung ương; Bí thư Ban Cán sự đảng, Bí thư Đảng ủy, Tổng Thanh tra Chính phủ; Đ ại biểu Quốc hội khóa XIV",12/2018,10/2020
5722,Lê Minh Khái,,"Ủy viên Trung ương Đảng, Bí thư Ban Cán sự đảng, Bí thư Đảng ủy, Tổng Thanh tra Chính phủ; Đ ại biểu Quốc hội khóa XIV",10/2020,4/2021
5723,Lê Minh Khái,,Tại Đại hội đại biểu toàn quốc lần thứ XIII đồng chí được bầu tái cử Ban Chấp hành Trung ương và được Ban Chấp hành Trung ương bầu vào Ban Bí thư khóa XIII,,
5724,Lê Minh Khái,,Bí thư Trung ương Đảng; Ủy viên Ban cán sự Đảng Chính phủ; Phó Thủ tướng Chính phủ; Đại biểu Quốc hội khóa XIV,4/2021,8/2024
5725,Lê Minh Khái,,"3/8/2024: Ban Chấp hành Trung ương Đảng thống nhất để đồng chí Lê Minh Khái thôi giữ chức Bí thư Trung ương Đảng, Ủy viên Trung ương khóa XIII",,
5726,Lê Minh Khái,,"26/8/2024: Tại kỳ họp bất thường lần thứ 8 Quốc hội khóa XV, Quốc hội phê chuẩn miễn nhiệm chức vụ Phó Thủ tướng Chính phủ nhiệm kỳ 2021 - 2026",,
5727,Vũ Đức Đam,,"TÓM TẮT QUÁ TRÌNH CÔNG TÁC 10/1988 - 10/1990: Kỹ sư, Công ty XNK và Dịch vụ Kỹ thuật Bưu điện, Tổng cục Bưu điện",,
5728,Vũ Đức Đam,,"10/1990 - 2/1992: Chuyên viên, Ban Phát triển kỹ thuật và Quan hệ đối ngoại, Tổng Công ty Bưu chính viễn thông Việt Nam",,
5729,Vũ Đức Đam,,"02/1992 - 4/1993: Chuyên viên, Văn phòng Tổng cục Bưu điện",,
5730,Vũ Đức Đam,,"4/1993 - 10/1994: Phó Vụ trưởng Vụ Khoa học công nghệ và Hợp tác quốc tế, Tổng cục Bưu điện",,
5731,Vũ Đức Đam,,"10/1994 - 11/1995: Phó Vụ trưởng Vụ Quan hệ quốc tế, Văn phòng Chính phủ",,
5732,Vũ Đức Đam,,"11/1995 - 8/1996: Quyền Vụ trưởng rồi Vụ trưởng Vụ ASEAN, Văn phòng Chính phủ",,
5733,Vũ Đức Đam,,8/1996 - 3/2003: Thư ký rồi Trợ lý Cố Thủ tướng Võ Văn Kiệt,,
5734,Vũ Đức Đam,,"3/2003 - 8/2005: Ủy viên Ban Thường vụ Tỉnh ủy, Phó Chủ tịch rồi Phó Chủ tịch thường trực UBND tỉnh Bắc Ninh, Đại biểu HĐND tỉnh (từ tháng 4/2004)",,
5735,Vũ Đức Đam,,8/2005 - 11/2007: Thứ trưởng Bộ Bưu chính - Viễn thông (Ủy viên dự khuyết Trung ương Đảng khóa X từ tháng 4/2006),,
5736,Vũ Đức Đam,,"11/2007 - 5/2008: Ủy viên dự khuyết Trung ương Đảng, Phó Bí thư thường trực Tỉnh ủy tỉnh Quảng Ninh",,
5737,Vũ Đức Đam,,"5/2008 - 3/2010: Ủy viên dự khuyết Trung ương Đảng, Phó Bí thư - Chủ tịch UBND tỉnh Quảng Ninh",,
5738,Vũ Đức Đam,,"3/2010 - 8/2010: Ủy viên dự khuyết Trung ương Đảng, Bí thư tỉnh ủy, Chủ tịch UBND tỉnh Quảng Ninh",,
5739,Vũ Đức Đam,,"8/2010 - 8/2011: Ủy viên dự khuyết Trung ương Đảng (Ủy viên Trung ương Đảng khóa XI từ tháng 01/2011), Bí thư Tỉnh ủy tỉnh Quảng Ninh",,
5740,Vũ Đức Đam,,"8/2011 - 11/2013: Ủy viên Trung ương Đảng, Ủy viên Ban Cán sự đảng Chính phủ, Bộ trưởng, Chủ nhiệm Văn phòng Chính phủ",,
5741,Vũ Đức Đam,,"11/2013 - 10/2019: Ủy viên Trung ương Đảng, Ủy viên Ban Cán sự đảng Chính phủ, Phó Thủ tướng Chính phủ",,
5742,Vũ Đức Đam,,"10/2019 - 12/2019: Ủy viên Trung ương Đảng, Ủy viên Ban Cán sự đảng Chính phủ, Phó Thủ tướng Chính phủ kiêm Bí thư Ban Cán sự đảng Bộ Y tế",,
5743,Vũ Đức Đam,,"12/2019 - 7/2020: Ủy viên Trung ương Đảng, Ủy viên Ban Cán sự đảng Chính phủ, Phó Thủ tướng Chính phủ kiêm Bí thư Ban Cán sự đảng Bộ Y tế, điều hành công việc thuộc thẩm quyền của Bộ trưởng Bộ Y tế",,
5744,Vũ Đức Đam,,"7/2020 - 01/2023: Ủy viên Trung ương Đảng (đến 30/12/2022) , Ủy viên Ban Cán sự đảng Chính phủ, Phó Thủ tướng Chính phủ",,
5745,Vũ Đức Đam,,"Tại Đại hội đại biểu toàn quốc lần thứ XIII của Đảng, được bầu lại vào Ban Chấp hành Trung ương Đảng",,
5746,Vũ Đức Đam,,"05/01/2023: Tại Kỳ họp bất thường lần thứ 2 - Quốc hội khóa XV, Quốc hội phê chuẩn miễn nhiệm chức vụ Phó Thủ tướng Chính phủ",,
5747,Vũ Đức Đam,,https://vuducdam.chinhphu.vn/,,
5748,Vũ Đức Đam,,"TÓM TẮT QUÁ TRÌNH CÔNG TÁC 10/1988 - 10/1990: Kỹ sư, Công ty XNK và Dịch vụ Kỹ thuật Bưu điện, Tổng cục Bưu điện",,
5749,Vũ Đức Đam,,"Chuyên viên, Ban Phát triển kỹ thuật và Quan hệ đối ngoại, Tổng Công ty Bưu chính viễn thông Việt Nam",10/1990,2/1992
5750,Vũ Đức Đam,,"Chuyên viên, Văn phòng Tổng cục Bưu điện",02/1992,4/1993
5751,Vũ Đức Đam,,"Phó Vụ trưởng Vụ Khoa học công nghệ và Hợp tác quốc tế, Tổng cục Bưu điện",4/1993,10/1994
5752,Vũ Đức Đam,,"Phó Vụ trưởng Vụ Quan hệ quốc tế, Văn phòng Chính phủ",10/1994,11/1995
5753,Vũ Đức Đam,,"Quyền Vụ trưởng rồi Vụ trưởng Vụ ASEAN, Văn phòng Chính phủ",11/1995,8/1996
5754,Vũ Đức Đam,,Thư ký rồi Trợ lý Cố Thủ tướng Võ Văn Kiệt,8/1996,3/2003
5755,Vũ Đức Đam,,"Ủy viên Ban Thường vụ Tỉnh ủy, Phó Chủ tịch rồi Phó Chủ tịch thường trực UBND tỉnh Bắc Ninh, Đại biểu HĐND tỉnh (từ tháng 4/2004)",3/2003,8/2005
5756,Vũ Đức Đam,,Thứ trưởng Bộ Bưu chính - Viễn thông (Ủy viên dự khuyết Trung ương Đảng khóa X từ tháng 4/2006),8/2005,11/2007
5757,Vũ Đức Đam,,"Ủy viên dự khuyết Trung ương Đảng, Phó Bí thư thường trực Tỉnh ủy tỉnh Quảng Ninh",11/2007,5/2008
5758,Vũ Đức Đam,,"Ủy viên dự khuyết Trung ương Đảng, Phó Bí thư - Chủ tịch UBND tỉnh Quảng Ninh",5/2008,3/2010
5759,Vũ Đức Đam,,"Ủy viên dự khuyết Trung ương Đảng, Bí thư tỉnh ủy, Chủ tịch UBND tỉnh Quảng Ninh",3/2010,8/2010
5760,Vũ Đức Đam,,"Ủy viên dự khuyết Trung ương Đảng (Ủy viên Trung ương Đảng khóa XI từ tháng 01/2011), Bí thư Tỉnh ủy tỉnh Quảng Ninh",8/2010,8/2011
5761,Vũ Đức Đam,,"Ủy viên Trung ương Đảng, Ủy viên Ban Cán sự đảng Chính phủ, Bộ trưởng, Chủ nhiệm Văn phòng Chính phủ",8/2011,11/2013
5762,Vũ Đức Đam,,"Ủy viên Trung ương Đảng, Ủy viên Ban Cán sự đảng Chính phủ, Phó Thủ tướng Chính phủ",11/2013,10/2019
5763,Vũ Đức Đam,,"Ủy viên Trung ương Đảng, Ủy viên Ban Cán sự đảng Chính phủ, Phó Thủ tướng Chính phủ kiêm Bí thư Ban Cán sự đảng Bộ Y tế",10/2019,12/2019
5764,Vũ Đức Đam,,"Ủy viên Trung ương Đảng, Ủy viên Ban Cán sự đảng Chính phủ, Phó Thủ tướng Chính phủ kiêm Bí thư Ban Cán sự đảng Bộ Y tế, điều hành công việc thuộc thẩm quyền của Bộ trưởng Bộ Y tế",12/2019,7/2020
5765,Vũ Đức Đam,,"Ủy viên Trung ương Đảng (đến 30/12/2022) , Ủy viên Ban Cán sự đảng Chính phủ, Phó Thủ tướng Chính phủ",7/2020,01/2023
5766,Vũ Đức Đam,,"Tại Đại hội đại biểu toàn quốc lần thứ XIII của Đảng, được bầu lại vào Ban Chấp hành Trung ương Đảng",,
5767,Vũ Đức Đam,,"05/01/2023: Tại Kỳ họp bất thường lần thứ 2 - Quốc hội khóa XV, Quốc hội phê chuẩn miễn nhiệm chức vụ Phó Thủ tướng Chính phủ",,
5768,Vũ Đức Đam,,https://vuducdam,,
5797,Trần Lưu Quang,,"TÓM TẮT QUÁ TRÌNH CÔNG TÁC 6/1994 - 9/2010: Chuyên viên tại Sở Kế hoạch và Đầu tư, Công ty Phát triển hạ tầng Khu Công nghiệp Tây Ninh; Trưởng phòng thuộc Sở Kế hoạch và Đầu tư; Phó Ban Quản lý Khu kinh tế Cửa khẩu Mộc Bài; Phó Giám đốc Sở Kế hoạch và Đầu",,
5798,Trần Lưu Quang,,"10/2010 - 2/2019: Công tác tại tỉnh Tây Ninh; tại Đại hội Đại biểu toàn quốc lần thứ XI của Đảng tháng 1/2011, được bầu làm Ủy viên dự khuyết Trung ương Đảng; lần lượt giữ các chức vụ: Tỉnh ủy viên, Bí thư Huyện ủy Trảng Bàng, Phó Chủ tịch Thường trực UBN",,
5799,Trần Lưu Quang,,2/2019 - 4/2021: Phó Bí thư Thường trực Thành ủy Thành phố Hồ Chí Minh,,
5800,Trần Lưu Quang,,"Tại Đại hội Đại biểu toàn quốc lần thứ XIII của Đảng tháng 1/2021, đồng chí được bầu là Ủy viên Trung ương Đảng",,
5801,Trần Lưu Quang,,"4/2021 - 6/2021: Ủy viên Trung ương Đảng, Bí thư Thành ủy Hải Phòng nhiệm kỳ 2020-2025",,
5802,Trần Lưu Quang,,"7/2021 - 01/2023: Ủy viên Trung ương Đảng, Bí thư Thành ủy Hải Phòng; Đại biểu Quốc hội khóa XV và Trưởng Đoàn ĐBQH Hải Phòng, Tổ trưởng Tổ Đảng",,
5803,Trần Lưu Quang,,"05/01/2023: Tại Kỳ họp bất thường lần thứ 2 - Quốc hội khóa XV, Quốc hội phê chuẩn bổ nhiệm chức vụ Phó Thủ tướng Chính phủ",,
5804,Trần Lưu Quang,,"16/8/2024: Bộ Chính trị quyết định điều động, phân công, bổ nhiệm giữ chức Trưởng Ban Kinh tế Trung ương",,
5805,Trần Lưu Quang,,"26/8/2024: Tại kỳ họp bất thường lần thứ 8 Quốc hội khóa XV, Quốc hội phê chuẩn miễn nhiệm chức vụ Phó Thủ tướng Chính phủ nhiệm kỳ 2021 - 2026./.",,
5806,Trần Lưu Quang,,"TÓM TẮT QUÁ TRÌNH CÔNG TÁC 6/1994 - 9/2010: Chuyên viên tại Sở Kế hoạch và Đầu tư, Công ty Phát triển hạ tầng Khu Công nghiệp Tây Ninh; Trưởng phòng thuộc Sở Kế hoạch và Đầu tư; Phó Ban Quản lý Khu kinh tế Cửa khẩu Mộc Bài; Phó Giám đốc Sở Kế hoạch và Đầu tư; Chủ tịch UBND rồi Bí thư Huyện ủy Trảng Bàng, tỉnh Tây Ninh",,
5807,Trần Lưu Quang,,"Công tác tại tỉnh Tây Ninh; tại Đại hội Đại biểu toàn quốc lần thứ XI của Đảng tháng 1/2011, được bầu làm Ủy viên dự khuyết Trung ương Đảng; lần lượt giữ các chức vụ: Tỉnh ủy viên, Bí thư Huyện ủy Trảng Bàng, Phó Chủ tịch Thường trực UBND tỉnh; Ủy viên Ban Thường vụ Tỉnh ủy, Phó Chủ tịch Thường trực UBND tỉnh; Bí thư Tỉnh ủy; Chủ tịch HĐND tỉnh; Trưởng Đoàn Đại biểu Quốc hội tỉnh; tại Đại hội Đại biểu toàn quốc lần thứ XII của Đảng tháng 1/2016, được bầu làm Ủy viên Trung ương Đảng",10/2010,2/2019
5808,Trần Lưu Quang,,Phó Bí thư Thường trực Thành ủy Thành phố Hồ Chí Minh,2/2019,4/2021
5809,Trần Lưu Quang,,"Tại Đại hội Đại biểu toàn quốc lần thứ XIII của Đảng tháng 1/2021, đồng chí được bầu là Ủy viên Trung ương Đảng",,
5810,Trần Lưu Quang,,"Ủy viên Trung ương Đảng, Bí thư Thành ủy Hải Phòng nhiệm kỳ 2020-2025",4/2021,6/2021
5811,Trần Lưu Quang,,"Ủy viên Trung ương Đảng, Bí thư Thành ủy Hải Phòng; Đại biểu Quốc hội khóa XV và Trưởng Đoàn ĐBQH Hải Phòng, Tổ trưởng Tổ Đảng",7/2021,01/2023
5812,Trần Lưu Quang,,"05/01/2023: Tại Kỳ họp bất thường lần thứ 2 - Quốc hội khóa XV, Quốc hội phê chuẩn bổ nhiệm chức vụ Phó Thủ tướng Chính phủ",,
5813,Trần Lưu Quang,,"16/8/2024: Bộ Chính trị quyết định điều động, phân công, bổ nhiệm giữ chức Trưởng Ban Kinh tế Trung ương",,
5814,Trần Lưu Quang,,"26/8/2024: Tại kỳ họp bất thường lần thứ 8 Quốc hội khóa XV, Quốc hội phê chuẩn miễn nhiệm chức vụ Phó Thủ tướng Chính phủ nhiệm kỳ 2021 - 2026",,
5815,Lê Thành Long,,Học Cử nhân luật tại Đại học tổng hợp Adécbaijan (Liên Xô cũ),8/1982,8/1987
5854,Tô Lâm,,TÓM TẮT QUÁ TRÌNH CÔNG TÁC 10/1974 - 7/1979: Học viên Đại học An ninh nhân dân,,
5855,Tô Lâm,,"Cán bộ, Cục Bảo vệ Chính trị I, Bộ Công an",7/1979,12/1988
5856,Tô Lâm,,"Phó Trưởng phòng, Cục Bảo vệ Chính trị I, Tổng cục An ninh, Bộ Công an",12/1988,5/1990
5857,Tô Lâm,,"Trưởng phòng, Cục Bảo vệ Chính trị I, Tổng cục An ninh, Bộ Công an",5/1990,6/1993
5858,Tô Lâm,,"Phó Cục trưởng Cục Bảo vệ Chính trị I, Tổng cục An ninh, Bộ Công an",6/1993,5/1997
5859,Tô Lâm,,"Cục trưởng Cục Bảo vệ Chính trị III, Tổng cục An ninh, Bộ Công an",5/1997,6/2006
5860,Tô Lâm,,"Phó Tổng cục trưởng Tổng cục An ninh, Bộ Công an",6/2006,12/2009
5861,Tô Lâm,,"Phó Tổng cục trưởng, phụ trách Tổng cục An ninh, Bộ Công an",12/2009,02/2010
5862,Tô Lâm,,"Tổng cục trưởng Tổng cục An ninh I, Bộ Công an",02/2010,7/2010
5863,Tô Lâm,,- Thứ trưởng Bộ Công an,8/2010,4/2016
5864,Tô Lâm,,- Tháng 01/2011: Ủy viên Trung ương Đảng khóa XI,,
5865,Tô Lâm,,"- Tháng 01/2016: Ủy viên Trung ương Đảng, Ủy viên Bộ Chính trị khóa XII",,
5866,Tô Lâm,,"Ủy viên Bộ Chính trị, Ủy viên Ban Cán sự đảng Chính phủ, Bí thư Đảng ủy Công an Trung ương, Bộ trưởng Bộ Công an",4/2016,5/2024
5867,Tô Lâm,,"Tháng 01/2021: Ủy viên Trung ương Đảng, Ủy viên Bộ Chính trị khóa XIII",,
5868,Tô Lâm,,"Phó trưởng Ban Chỉ đạo Trung ương về phòng, chống tham nhũng; Phó Trưởng Tiểu ban Bảo vệ chính trị nội bộ Trung ương; Ủy viên Hội đồng Quốc phòng và An ninh, Ủy viên Ban Chỉ đạo Cải cách tư pháp Trung ương",,
5869,Tô Lâm,,"Đại biểu Quốc hội khóa XIV, XV",,
5870,Tô Lâm,,Ngày 22/5/2024: Được Quốc hội bầu giữ chức Chủ tịch nước Cộng hòa xã hội Chủ nghĩa Việt Nam nhiệm kỳ 2021 – 2026,,
5952,Nguyễn Văn Thể,,"TÓM TẮT QUÁ TRÌNH CÔNG TÁC 12/1989 - 9/1992: Kỹ sư, Cán bộ kế hoạch kỹ thuật Công ty Dịch vụ thiết bị vật tư giao thông thủy lợi huyện Tháp Mười",,
5953,Nguyễn Văn Thể,,Cán bộ Phòng Giao thông công chánh huyện Tháp Mười,10/1992,01/1995
5954,Nguyễn Văn Thể,,"Trợ lý thiết kế, sau đó Phó Giám đốc Xí nghiệp khảo sát thiết kế giao thông tỉnh Đồng Tháp",01/1995,11/1998
5955,Nguyễn Văn Thể,,"Nghiên cứu sinh tại Trường Đại học giao thông đường bộ Moskva, Cộng hòa Liên bang Nga",11/1998,8/2001
5956,Nguyễn Văn Thể,,Phó Giám đốc Công ty Tư vấn xây dựng giao thông tỉnh Đồng Tháp,8/2001,6/2004
5957,Nguyễn Văn Thể,,Chuyên viên rồi Phó Giám đốc Sở Giao thông vận tải tỉnh Đồng Tháp; Học viên Học viện Chính trị quốc gia Hồ Chí Minh,7/2004,6/2010
5958,Nguyễn Văn Thể,,"Phó Bí thư Huyện ủy Tân Hồng, tỉnh Đồng Tháp",6/2010,8/2010
5959,Nguyễn Văn Thể,,"Ủy viên Ban Thường vụ Tỉnh ủy, Bí thư Huyện ủy Tân Hồng tỉnh Đồng Tháp",9/2010,7/2012
5960,Nguyễn Văn Thể,,Tại Đại hội đại biểu toàn quốc lần thứ XI của Đảng được bầu làm Ủy viên dự khuyết Ban chấp hành Trung ương Đảng,,
5961,Nguyễn Văn Thể,,"Ủy viên Dự khuyết Ban Chấp hành Trung ương Đảng, Ủy viên Ban Thường vụ Tỉnh ủy, Phó Chủ tịch Ủy ban nhân dân tỉnh Đồng Tháp nhiệm kỳ 2011-2016",8/2012,6/2013
5962,Nguyễn Văn Thể,,"Ủy viên Dự khuyết Ban Chấp hành Trung ương Đảng, Ủy viên Ban Cán sự Đảng, Thứ trưởng Bộ Giao thông vận tải",6/2013,10/2015
5963,Nguyễn Văn Thể,,"Ủy viên Dự khuyết Ban Chấp hành Trung ương Đảng, Bí thư Tỉnh ủy Sóc Trăng",10/2015,7/2016
5964,Nguyễn Văn Thể,,"Tại Đại hội đại biểu toàn quốc lần thứ XII của Đảng, được bầu vào Ban Chấp hành Trung ương Đảng; được bầu là Đại biểu Quốc hội khóa XIV (tháng 5/2016)",,
5965,Nguyễn Văn Thể,,"Ủy viên Trung ương Đảng, Bí thư Tỉnh ủy, Trưởng Đoàn đại biểu Quốc hội khóa XIV tỉnh Sóc Trăng",7/2016,10/2017
5966,Nguyễn Văn Thể,,"Ủy viên Trung ương Đảng, Bí thư Ban Cán sự đảng, Bộ trưởng Bộ Giao thông vận tải, Trưởng Đoàn đại biểu Quốc hội khóa XIV tỉnh Sóc Trăng",10/2017,01/2018
5967,Nguyễn Văn Thể,,"Từ 01/2018 đến nay: Ủy viên Trung ương Đảng, Bí thư Ban Cán sự đảng, Bộ trưởng Bộ Giao thông vận tải, Đại biểu Quốc hội khóa XIV",,
5968,Nguyễn Văn Thể,,"Tại Đại hội đại biểu toàn quốc lần thứ XIII của Đảng, được bầu lại vào Ban Chấp hành Trung ương Đảng",,
5985,Nguyễn Thanh Nghị,,TÓM TẮT QUÁ TRÌNH CÔNG TÁC 6/1999 - 01/2007: Giảng viên tại Bộ môn Kỹ thuật - Khoa học ứng dụng - Trường Đại học Kiến trúc TP,,
