ID,Person,Organization,Title,Start,End
6259,Lương Tam Quang,,"Phó Cục trưởng Cục An ninh kinh tế tổng hợp, Tổng cục An ninh II, Bộ Công an",12/2009,7/2010
6260,Lương Tam Quang,,Cục trưởng - Phó Chánh Văn phòng Bộ Công an,8/2010,9/2017
6261,Lương Tam Quang,,Tháng 11/2014 được thăng quân hàm Thiếu tướng,,
6262,Lương Tam Quang,,Chánh Văn phòng Bộ Công an,9/2017,8/2019
6263,Lương Tam Quang,,Tháng 01/2019 được thăng quân hàm Trung tướng,,
6264,Lương Tam Quang,,Thứ trưởng Bộ Công an (được bổ nhiệm Thủ trưởng Cơ quan An ninh điều tra Bộ Công an tháng 5/2020; Ủy viên Ban Thường vụ Đảng ủy Công an Trung ương tháng 01/2020),8/2019,6/2024
6265,Lương Tam Quang,,Từ 1/2021: Ủy viên Ban Chấp hành Trung ương Đảng khóa XIII; tháng 01/2022 được thăng quân hàm Thượng tướng,,
6266,Lương Tam Quang,,"06/6/2024: Tại kỳ họp thứ 7, Quốc hội khóa XV, được Quốc hội phê chuẩn giữ chức Bộ trưởng Bộ Công an nhiệm kỳ 2021 - 2026",,
6267,Lương Tam Quang,,16/8/2024: Được Ban Chấp hành Trung ương Đảng khóa XIII bầu là Uỷ viên Bộ Chính trị,,
6268,Lương Tam Quang,,Tháng 10/2024: Được thăng quân hàm Đại tướng,,
6269,Lương Tam Quang,,"24/01/2025: Bộ Chính trị chỉ định tham gia Ban Chấp hành, Ban Thường vụ Đảng ủy Chính phủ nhiệm kỳ 2020 – 2025",,
6270,Bùi Thanh Sơn,,"TÓM TẮT QUÁ TRÌNH CÔNG TÁC 02/1985 - 4/1987: Vào ngành Ngoại giao (2/1985), nhập ngũ từ 2/1985 tới 4/1987",,
6271,Bùi Thanh Sơn,,Được tiếp nhận về Bộ Ngoại giao (5/1987); điều động về Học viện Quan hệ quốc tế từ tháng 9/1987 tới tháng 8/1991 (trong đó đi học tiếng Nhật tại Nhật Bản từ tháng 9/1988 tới tháng 12/1989),5/1987,8/1991
6272,Bùi Thanh Sơn,,Học Thạc sỹ Quan hệ quốc tế tại Mỹ,9/1991,6/1993
6273,Bùi Thanh Sơn,,"Chuyên viên, Trưởng Ban nghiên cứu Âu-Mỹ, Chánh Văn phòng, Tập sự Phó Vụ trưởng Học viện Quan hệ quốc tế, Bộ Ngoại giao",6/1993,3/1996
6274,Bùi Thanh Sơn,,"Phó Vụ trưởng, Phó Giám đốc, Bí thư Đảng ủy Học viện Quan hệ quốc tế; Đảng ủy viên Đảng ủy Bộ Ngoại giao, Đảng ủy viên Đảng ủy khối Đối ngoại Trung ương",3/1996,02/2000
6275,Bùi Thanh Sơn,,"Tham tán Công sứ, Người thứ Hai, Đại sứ quán Việt Nam tại Singapore",3/2000,7/2003
6276,Bùi Thanh Sơn,,"Phó Vụ trưởng Vụ Chính sách đối ngoại, Bộ Ngoại giao",8/2003,8/2007
6277,Bùi Thanh Sơn,,"Vụ trưởng Vụ Chính sách đối ngoại, Đảng ủy viên Đảng ủy Bộ Ngoại giao",8/2007,9/2008
6278,Bùi Thanh Sơn,,Trợ lý Bộ trưởng kiêm Vụ trưởng Vụ Chính sách đối ngoại; Đảng ủy viên Đảng ủy Bộ Ngoại giao (từ 05/2009: thôi kiêm Vụ trưởng Vụ Chính sách đối ngoại),9/2008,11/2009
6279,Bùi Thanh Sơn,,"Thứ trưởng Bộ Ngoại giao, Ủy viên Ban cán sự đảng Bộ, Bí thư Đảng ủy Bộ Ngoại giao (từ 07/2015); Ủy viên Ban Chấp hành Đảng bộ khối các cơ quan Trung ương (từ 10/2015)",11/2009,01/2016
6280,Bùi Thanh Sơn,,"- Ủy viên Ban Chấp hành Trung ương Đảng khóa XII; - Đại biểu Quốc hội Khóa XIV (Đắk Nông) từ tháng 7/2016; - Thứ trưởng Bộ Ngoại giao (Thứ trưởng thường trực từ tháng 7/2016); - Ủy viên Ban cán sự đảng Bộ Ngoại giao (Phó Bí thư Ban cán sự đảng từ tháng 7/2016); - Bí thư đảng ủy Bộ Ngoại giao nhiệm kỳ 2015-2020, ngày 11/8/2020 được bầu lại là Bí thư Đảng ủy Bộ Ngoại giao nhiệm kỳ 2020 – 2025; - Ủy viên Ban chấp hành Đảng bộ Khối các cơ quan Trung ương nhiệm kỳ 2015-2020",01/2016,4/2021
6281,Bùi Thanh Sơn,,"- Ủy viên Ban Chấp hành Trung ương Đảng khóa XIII; - Đại biểu Quốc hội Khóa XV (Vĩnh Phúc) từ tháng 6/2021; - Bộ trưởng Bộ Ngoại giao, Bí thư Ban cán sự đảng, Bí thư Đảng ủy Bộ Ngoại giao; - Ủy viên Ban Thường vụ Đảng ủy Khối các cơ quan Trung ương",4/2021,nay
6282,Bùi Thanh Sơn,,"26/8/2024: Tại kỳ họp bất thường lần thứ 8 Quốc hội khóa XV, được Quốc hội phê chuẩn bổ nhiệm chức vụ Phó Thủ tướng Chính phủ nhiệm kỳ 2021 – 2026",,
6283,Nguyễn Hải Ninh,,"TÓM TẮT QUÁ TRÌNH CÔNG TÁC 9/1998 - 9/2000 : Chuyên viên Phòng Tổng hợp, Văn phòng Ban Nội chính Trung ương",,
6284,Nguyễn Hải Ninh,,Chuyên viên Vụ Pháp luật Ban Nội chính Trung ương,9/2000,12/2006
6285,Nguyễn Hải Ninh,,"Phó Vụ trưởng Vụ Pháp luật, Ban Nội chính Trung ương",12/2006,4/2007
6286,Nguyễn Hải Ninh,,"Phó Vụ trưởng Vụ Pháp luật và Cải cách tư pháp, Văn phòng Trung ương Đảng",4/2006,9/2011
6287,Nguyễn Hải Ninh,,"Phó Vụ trưởng Vụ Thư ký, Thư ký đồng chí Chánh Văn phòng Trung ương Đảng",9/2011,11/2013
6288,Nguyễn Hải Ninh,,"Vụ trưởng, Thư ký đồng chí Chánh Văn phòng Trung ương Đảng",11/2013,10/2014
6289,Nguyễn Hải Ninh,,"Tỉnh uỷ viên, Phó Chủ tịch UBND tỉnh Đắk Lắk (từ tháng 12/2014)",10/2014,12/2015
6290,Nguyễn Hải Ninh,,"Uỷ viên Ban Thường vụ Tỉnh ủy, Phó Chủ tịch UBND tỉnh Đắk Lắk",12/2025,6/2016
6291,Nguyễn Hải Ninh,,"Tại Đại hội đại biểu toàn quốc lần thứ XII của Đảng được bầu làm Ủy viên dự khuyết Ban Chấp hành Trung ương Đảng 6/2016 - 3/2019 Ủy viên Ban Thường vụ Tỉnh ủy, Phó Chủ tịch Thường trực UBND tỉnh Đắk Lắk",01/2016,
6292,Nguyễn Hải Ninh,,Phó Chánh Văn phòng Trung ương Đảng,3/2019,4/2021
6293,Nguyễn Hải Ninh,,Tại Đại hội đại biểu toàn quốc lần thứ XIII của Đảng được bầu làm Ủy viên Ban Chấp hành Trung ương Đảng,01/2021,
6294,Nguyễn Hải Ninh,,Bí thư Tỉnh ủy Khánh Hòa,4/2021,8/2024
6295,Nguyễn Hải Ninh,,"Ủy viên Trung ương Đảng, Bộ trưởng Bộ Tư pháp",8/2024,nay
6296,Nguyễn Hải Ninh,,24/01/2025 Bộ Chính trị chỉ định tham gia Ban Chấp hành Đảng bộ Chính phủ nhiệm kỳ 2020 – 2025,,
6297,Nguyễn Văn Thắng,,TÓM TẮT QUÁ TRÌNH CÔNG TÁC Năm 1996: Cán bộ kinh doanh đối ngoại Chi nhánh Ngân hàng Thương mại Cổ phần Công Thương Việt Nam (VietinBank) Ba Đình,,
6298,Nguyễn Văn Thắng,,Năm 2000: Thư ký Tổng giám đốc VietinBank,,
6299,Nguyễn Văn Thắng,,"Năm 2003: Thư ký Tổng giám đốc, kiêm Phó Chánh Văn phòng VietinBank",,
6300,Nguyễn Văn Thắng,,"Năm 2006-2009: Phó trưởng phòng, Trưởng phòng Khách hàng doanh nghiệp lớn của VietinBank",,
6301,Nguyễn Văn Thắng,,"Ủy viên Ban Chấp hành Đảng bộ, Ủy viên Ban Thường vụ Đảng ủy, Ủy viên HĐQT, Tổng Giám đốc VietinBank",12/2011,4/2014
6302,Nguyễn Văn Thắng,,"Bí thư Đảng ủy, Chủ tịch HĐQT VietinBank",5/2014,9/2014
6303,Nguyễn Văn Thắng,,"Ủy viên Ban Thường vụ Đảng ủy Khối Doanh nghiệp Trung ương; Bí thư Đảng ủy, Chủ tịch HĐQT VietinBank",9/2014,1/2016
6304,Nguyễn Văn Thắng,,"Ủy viên dự khuyết Ban Chấp hành Trung ương Đảng khóa XII, Ủy viên Ban Thường vụ Đảng ủy Khối Doanh nghiệp Trung ương; Bí thư Đảng ủy, Chủ tịch HĐQT VietinBank",1/2016,7/2018
6305,Nguyễn Văn Thắng,,"Bộ Chính trị luân chuyển, chỉ định tham gia Ban Chấp hành, Ban Thường vụ Tỉnh ủy Quảng Ninh khóa XIV, nhiệm kỳ 2015 - 2020; HĐND tỉnh bầu giữ chức Phó Chủ tịch UBND tỉnh Quảng Ninh khóa XIII, nhiệm kỳ 2016- 2021",7/2018,6/2019
6306,Nguyễn Văn Thắng,,"Phó Bí thư Tỉnh ủy khóa XIV, nhiệm kỳ 2015 - 2020; Phó Chủ tịch UBND tỉnh Quảng Ninh khóa XIII, nhiệm kỳ 2016 - 2021",6/2019,7/2019
6307,Nguyễn Văn Thắng,,"Phó Bí thư Tỉnh ủy khóa XIV, Chủ tịch UBND tỉnh Quảng Ninh khóa XIII, nhiệm kỳ 2016 - 2021",7/2019,10/2020
6308,Nguyễn Văn Thắng,,"14/10/2020: Tại Đại hội đại biểu Đảng bộ tỉnh Điện Biên lần thứ XIV, được bầu giữ chức Bí thư Tỉnh ủy khóa XIV, nhiệm kỳ 2020-2025",,
6309,Nguyễn Văn Thắng,,"30/1/2021: Tại Đại hội đại biểu toàn quốc lần thứ XIII của Đảng, được bầu làm Ủy viên chính thức Ban Chấp hành Trung ương Đảng khóa XIII, nhiệm kỳ 2021-2026",,
6310,Nguyễn Văn Thắng,,"Ủy viên Trung ương Đảng, Bộ trưởng Bộ Giao thông vận tải",10/2022,11/2024
6311,Nguyễn Văn Thắng,,"Ủy viên Trung ương Đảng, Bộ trưởng Bộ Tài chính",11/2024,nay
6312,Nguyễn Văn Thắng,,24/01/2025: Bộ Chính trị chỉ định tham gia Ban Chấp hành Đảng bộ Chính phủ nhiệm kỳ 2020 – 2025,,
6313,Trần Hồng Minh,Truong si quan cong binh 2,"8/1987- 8/1996 : Quân hàm Trung úy, Đại úy; Giảng viên bộ môn Đường, Khoa Cầu đường vượt sông, Trường sỹ quan công binh, Binh chủng Công binh; Kỹ sư xây dựng công trình quốc phòng",,
6314,Trần Hồng Minh,,": Quân hàm Thiếu tá, Trung tá; Kỹ sư, thạc sĩ ngành Xây dựng công trình quốc phòng, Học viện Kỹ thuật Quân sự; Trưởng bộ môn Đường, Khoa Cầu đường vượt sông, Trường Sĩ quan Công binh, Binh chủng Công binh",9/1996,8/2003
6315,Trần Hồng Minh,,": Quân hàm Trung tá, Thượng tá (8/2004); Phó trưởng khoa Cầu đường Vượt sông, Trường Sĩ quan Công binh, Binh chủng Công binh; Nghiên cứu sinh, Tiến sĩ ngành Cầu đường - Nền móng và công trình ngầm, Đại học Bách khoa TP",2/2003,3/2007
6316,Trần Hồng Minh,,HCM (11/2004 - 12/2007),,
6317,Trần Hồng Minh,,": Quân hàm Thượng tá, Đại tá (8/2008); Trưởng khoa Cầu đường Vượt sông, Trường Sĩ quan Công binh, Binh chủng Công binh",4/2007,2/2009
6318,Trần Hồng Minh,,": Đại tá, Lữ đoàn trưởng Lữ đoàn 249, Binh chủng Công binh; Phó Bí thư Đảng ủy Lữ đoàn 249",3/2009,3/2011
6319,Trần Hồng Minh,,": Đại tá, Phó tham mưu trưởng, Phó Tư lệnh kiêm Tham mưu trưởng, Binh chủng Công binh",4/2011,11/2014
6320,Trần Hồng Minh,,"Thiếu tướng (12/2014), Tư lệnh Binh chủng Công binh; Phó cơ quan Thường trực Ban Chỉ đạo 504, kiêm Tổng Giám đốc Trung tâm hành động bom mìn Quốc gia Việt Nam",8/2014,4/2016
6321,Trần Hồng Minh,,"Thiếu tướng, Phó Tư lệnh, Tham mưu trưởng Quân khu 1",5/2016,12/2017
6322,Trần Hồng Minh,,"Thiếu tướng, Trung tướng (12/2018), Tư lệnh Quân khu 1",1/2018,9/2019
6323,Trần Hồng Minh,,"Trung tướng, Chủ nhiệm Tổng cục Công nghiệp Quốc phòng",10/2019,1/2021
6324,Trần Hồng Minh,,"Ủy viên Trung ương Đảng khóa XIII; Ủy viên Quân ủy Trung ương (6/2021); Trung tướng, Chủ nhiệm Tổng cục Công nghiệp Quốc phòng; Đại biểu Quốc hội khóa XV (7/2021)",1/2021,9/2021
6325,Trần Hồng Minh,,"Ủy viên Trung ương Đảng khóa XIII, Bí thư Tỉnh ủy Cao Bằng; Đại biểu Quốc hội khóa XV",9/2021,11/2024
6326,Trần Hồng Minh,,"28/11/2024 - 02/2025: Ủy viên Trung ương Đảng, Bộ trưởng Bộ Giao thông vận tải",,
6327,Trần Hồng Minh,,24/01/2025: Bộ Chính trị chỉ định tham gia Ban Chấp hành Đảng bộ Chính phủ nhiệm kỳ 2020 – 2025,,
6328,Trần Hồng Minh,,"01/3/2025: Ủy viên Trung ương Đảng, Bộ trưởng Bộ Xây dựng",,
6329,Nguyễn Văn Hùng,,"TÓM TẮT QUÁ TRÌNH CÔNG TÁC 3/1979 - 7/1983: Nhập ngũ vào Quân chủng Hải quân, đào tạo kế toán tài vụ, trợ lý quân nhu, quản lý tiểu đoàn 5; Tiểu đội trưởng, Tiểu đoàn 8, Đoàn 403, Bộ Tư lệnh Hải quân",,
6330,Nguyễn Văn Hùng,,"Xuất ngũ, chuyển công tác về huyện đoàn Bến Hải, tỉnh Bình Trị Thiên; Ủy viên Ban Chấp hành Huyện đoàn",7/1983,9/1984
6331,Nguyễn Văn Hùng,,"Công tác tại huyện đoàn Bến Hải, Ủy viên Ban Chấp hành, ủy viên Ban Thường vụ huyện đoàn, phụ trách thanh niên công nhân và quốc phòng - an ninh",9/1984,8/1988
6332,Nguyễn Văn Hùng,,"Tháng 9/1984 - 9/1988: Học Trường Đoàn Cao cấp, Trưởng Ban Cán sự, Phó Bí thư Chi bộ khóa III cao cấp",,
6333,Nguyễn Văn Hùng,,"Phó ban tỉnh đoàn Bình Trị Thiên, Phó Bí thư Đoàn Dân chính Đảng, Bình Trị Thiên",8/1988,7/1989
6334,Nguyễn Văn Hùng,,"Ủy viên Ban chấp hành, Phó Ban Phong trào, Ủy viên Ban Thường vụ Tỉnh đoàn, Trưởng Ban Phong trào; Phó Chủ nhiệm UBKT Tỉnh đoàn, Trưởng Ban Phong trào Tỉnh đoàn kiêm Bí thư Đoàn Dân chính Đảng",7/1989,12/1991
6335,Nguyễn Văn Hùng,,"Phó Bí thư Thường trực Tỉnh đoàn, Ủy viên Ban Chấp hành Trung ương Đoàn, Ủy viên Trung ương Hội Liên hiệp thanh niên Việt Nam, Chủ tịch Hội Liên hiệp thanh niên tỉnh Quảng Trị, Bí thư Chi bộ cơ quan Tỉnh đoàn",01/1992,11/1997
6336,Nguyễn Văn Hùng,,"Tỉnh ủy viên, Ủy viên Ban Chấp hành Trung ương Đoàn, Ủy viên Trung ương Hội Liên hiệp thanh niên Việt Nam, Bí thư tỉnh Đoàn Quảng Trị, Chủ tịch Hội Liên hiệp thanh niên tỉnh Quảng Trị, Bí thư Chi bộ cơ quan Tỉnh đoàn",11/1997,4/2001
6337,Nguyễn Văn Hùng,,"Tỉnh ủy viên, Phó Chủ nhiệm Thường trực Ủy ban Kiểm tra Tỉnh ủy, Bí thư Chi bộ cơ quan Ủy ban kiểm tra, Tỉnh ủy Quảng Trị",4/2001,4/2004
6338,Nguyễn Văn Hùng,,"Tỉnh ủy viên, Phó Bí thư Huyện ủy, Chủ tịch UBND huyện Đakrông",4/2004,01/2008
6339,Nguyễn Văn Hùng,,"Tỉnh ủy viên, Phó Bí thư Thành ủy, Chủ tịch UBND thành phố Đông Hà",01/2008,6/2011
6340,Nguyễn Văn Hùng,,"Tỉnh ủy viên, Ủy viên Ban Thường vụ Tỉnh ủy, Bí thư Thành ủy, Chủ tịch HĐND thành phố Đông Hà",6/2011,12/2014
6341,Nguyễn Văn Hùng,,"Ủy viên Ban Thường vụ Tỉnh ủy, Phó Bí thư Tỉnh ủy Quảng Trị",01/2015,10/2015
6342,Nguyễn Văn Hùng,,Bí thư Tỉnh ủy Quảng Trị,10/2015,7/2016
6343,Nguyễn Văn Hùng,,Tại Đại hội đại biểu toàn quốc lần thứ XII của Đảng được bầu vào Ban Chấp hành Trung ương Đảng,,
6344,Nguyễn Văn Hùng,,"Ủy viên Trung ương Đảng, Bí thư Tỉnh ủy, Chủ tịch HĐND tỉnh Quảng Trị",7/2016,7/2020
6345,Nguyễn Văn Hùng,,"Ủy viên Trung ương Đảng, Ủy viên Ban Cán sự Đảng, Thứ trưởng Bộ Văn hóa, Thể thao và Du lịch",7/2020,4/2021
6346,Nguyễn Văn Hùng,,"Tại Đại hội đại biểu toàn quốc lần thứ XIII của Đảng, được bầu lại vào Ban Chấp hành Trung ương Đảng",,
6347,Nguyễn Văn Hùng,,"Ủy viên Trung ương Đảng, Bộ trưởng Bộ Văn hóa, Thể thao và Du lịch",4/2021,nay
6348,Nguyễn Văn Hùng,,"24/01/2025: Bộ Chính trị chỉ định tham gia Ban Chấp hành, Ban Thường vụ Đảng ủy Chính phủ nhiệm kỳ 2020 – 2025",,
6349,Nguyễn Mạnh Hùng,,"TÓM TẮT QUÁ TRÌNH CÔNG TÁC 7/1979 - 7/1986: Chiến sỹ, sau là Học viên Trường Thông tin U-li-a-nốp (Liên Xô cũ)",,
6350,Nguyễn Mạnh Hùng,,"Trung úy, Thượng úy, Đại úy rồi Thiếu tá",8/1986,4/1997
6351,Nguyễn Mạnh Hùng,,"Trợ lý kỹ thuật Viện Kỹ thuật thông tin, rồi Công ty Điện tử thiết bị thông tin, Binh chủng Thông tin liên lạc",,
6352,Nguyễn Mạnh Hùng,,"Thiếu tá, Trung tá, rồi Thượng tá, Phó phòng, rồi Trưởng phòng Đầu tư, sau đó làm Phó Giám đốc Công ty Điện tử Viễn thông Quân đội, Binh chủng Thông tin liên lạc; Đảng ủy viên Công ty từ tháng 5/1998",5/1997,3/2005
6353,Nguyễn Mạnh Hùng,,"Thượng tá, Đại tá, Ủy viên Ban Thường vụ Đảng ủy, Phó Tổng Giám đốc Tổng Công ty Viễn thông Quân đội, sau là Tập đoàn Viễn thông Quân đội, Bộ Quốc phòng; được thăng quân hàm Thiếu tướng năm 2012",4/2005,01/2014
6354,Nguyễn Mạnh Hùng,,"Thiếu tướng, Phó Bí thư Đảng ủy, Tổng Giám đốc Tập đoàn Công nghiệp - Viễn thông Quân đội",02/2014,5/2018
6355,Nguyễn Mạnh Hùng,,"Tại Đại hội đại biểu toàn quốc lần thứ XII của Đảng, được bầu vào Ban Chấp hành Trung ương Đảng",,
6356,Nguyễn Mạnh Hùng,,Tham gia Quân ủy Trung ương nhiệm kỳ 2015-2020,,
6357,Nguyễn Mạnh Hùng,,"Ủy viên Trung ương Đảng, Ủy viên quân ủy Trung ương, Thiếu tướng, Chủ tịch kiêm Tổng Giám đốc Tập đoàn Công nghiệp - Viễn thông Quân đội",6/2018,7/2018
6358,Nguyễn Mạnh Hùng,,"Ủy viên Trung ương Đảng, Bí thư Ban cán sự Đảng, Quyền Bộ trưởng, rồi Bộ trưởng Bộ Thông tin và Truyền thông, kiêm Phó Trưởng Ban Tuyên giáo Trung ương",8/2018,02/2025
6359,Nguyễn Mạnh Hùng,,"Tại Đại hội đại biểu toàn quốc lần thứ XIII của Đảng, được bầu lại vào Ban Chấp hành Trung ương Đảng",,
6360,Nguyễn Mạnh Hùng,,24/01/2025: Bộ Chính trị chỉ định tham gia Ban Chấp hành Đảng bộ Chính phủ nhiệm kỳ 2020 – 2025,,
6361,Nguyễn Mạnh Hùng,,"01/03/2025: Ủy viên Trung ương Đảng, Bộ trưởng Bộ Khoa học và Công nghệ",,
6362,Nguyễn Kim Sơn,,TÓM TẮT QUÁ TRÌNH CÔNG TÁC 09/1985 - 06/1990: Sinh viên Khoa Ngữ văn (chuyên ngành Hán Nôm) tại Trường ĐH Tổng hợp Hà Nội,,
6363,Nguyễn Kim Sơn,,Học ngoại ngữ; chuẩn bị đề tài nghiên cứu; hoàn tất thủ tục chuyển tiếp nghiên cứu sinh tại Trường ĐH Tổng hợp Hà Nội,07/1990,03/1991
6364,Nguyễn Kim Sơn,,"Giảng viên Khoa Ngữ văn, Nghiên cứu sinh ngành Ngữ văn (chuyên ngành Văn học Việt Nam) tại Trường ĐH Tổng hợp Hà Nội; Ủy viên Thường vụ Đoàn TNCS HCM Trường ĐH Tổng hợp Hà Nội (từ 09/1991)",04/1991,12/1992
6365,Nguyễn Kim Sơn,,"Giảng viên Khoa Văn học, Trường ĐH Khoa học Xã hội và Nhân văn, ĐHQGHN (KHXH&NV); Nghiên cứu sinh ngành Ngữ văn (đến 04/1996)",01/1993,02/1999
6366,Nguyễn Kim Sơn,,"Giảng viên Khoa Văn học, Bí thư Đoàn TNCS HCM Trường ĐH Khoa học Xã hội và Nhân văn; Phó Bí thư Đoàn TNCS HCM - ĐHQGHN",03/1999,03/2002
6367,Nguyễn Kim Sơn,,"Phó Giám đốc Trung tâm Nghiên cứu Trung Quốc, Giảng viên Khoa Văn học, Bí thư Đoàn TNCS HCM Trường ĐH Khoa học Xã hội và Nhân văn; Phó Bí thư Đoàn TNCS HCM - ĐHQGHN",04/2002,03/2003
6368,Nguyễn Kim Sơn,,"Trưởng Phòng Đào tạo, Phó Giám đốc Trung tâm Nghiên cứu Trung Quốc, Giảng viên Khoa Văn học, Trường ĐH Khoa học Xã hội và Nhân văn; Bí thư Đoàn TNCS HCM Trường ĐH Khoa học Xã hội và Nhân văn, Phó Bí thư Đoàn TNCS HCM - ĐHQGHN (đến 12/2003)",04/2003,04/2006
6369,Nguyễn Kim Sơn,,"Trưởng Phòng Đào tạo, Giám đốc Trung tâm Nghiên cứu Trung Quốc, Giảng viên Khoa Văn học, Trường ĐH Khoa học Xã hội và Nhân văn",05/2006,05/2007
6370,Nguyễn Kim Sơn,,"Học giả nghiên cứu tại Học viện Harvard Yenching, Hoa Kỳ",06/2007,05/2008
6371,Nguyễn Kim Sơn,,"Giám đốc Trung tâm Nghiên cứu Trung Quốc, Giảng viên Khoa Văn học, Trường ĐH Khoa học Xã hội và Nhân văn",06/2008,10/2009
6372,Nguyễn Kim Sơn,,"Phó Hiệu trưởng, kiêm Giám đốc Trung tâm Nghiên cứu Trung Quốc; Phó Bí thư Đảng ủy Trường ĐH Khoa học Xã hội và Nhân văn (từ 06/2010)",11/2009,07/2010
6373,Nguyễn Kim Sơn,,"Đảng ủy viên Đảng ủy ĐHQGHN; Phó Bí thư Đảng ủy, Phó Hiệu trưởng, kiêm Giám đốc Trung tâm Nghiên cứu Trung Quốc, Trường ĐH Khoa học Xã hội và Nhân văn",08/2010,12/2011
6374,Nguyễn Kim Sơn,,"Phó Bí thư Đảng ủy, Phó Giám đốc ĐHQGHN",01/2012,02/2016
6375,Nguyễn Kim Sơn,,"Phó Bí thư Thường trực Đảng ủy, Phó Giám đốc Thường trực ĐHQGHN",02/2016,06/2016
6376,Nguyễn Kim Sơn,,"Phó Bí thư Thường trực Đảng ủy, Giám đốc ĐHQGHN",06/2016,09/2016
6377,Nguyễn Kim Sơn,,"Bí thư Đảng ủy, Giám đốc ĐHQGHN; Viện trưởng Viện Trần Nhân Tông (từ 02/2017)",09/2016,01/2019
6378,Nguyễn Kim Sơn,,"Bí thư Đảng ủy, Chủ tịch Hội đồng, Giám đốc ĐHQGHN; Viện trưởng Viện Trần Nhân Tông",01/2019,01/2021
6379,Nguyễn Kim Sơn,,"8/4/2021: Ủy viên BCH Trung ương Đảng; Bí thư Đảng ủy, Chủ tịch Hội đồng, Giám đốc ĐHQGHN; Viện trưởng Viện Trần Nhân Tông",01/2021,
6380,Nguyễn Kim Sơn,,"09/4/2021 - nay: Ủy viên BCH Trung ương Đảng; Bí thư Ban Cán sự Đảng, Bộ trưởng Bộ Giáo dục và Đào tạo; Viện trưởng Viện Trần Nhân Tông, ĐHQGHN",,
6381,Nguyễn Kim Sơn,,24/01/2025: Bộ Chính trị chỉ định tham gia Ban Chấp hành Đảng bộ Chính phủ nhiệm kỳ 2020 – 2025,,
6382,Đào Ngọc Dung,,"TÓM TẮT QUÁ TRÌNH CÔNG TÁC 1980 - 1982: Cán bộ Huyện đoàn Lý Nhân, tỉnh Hà Nam Ninh",,
6383,Đào Ngọc Dung,,"Ủy viên Ban Chấp hành, Ủy viên Ban Thường vụ Huyện đoàn Lý Nhân rồi Phó Bí thư Huyện đoàn, Phó Chủ tịch Ủy ban Thiếu niên nhi đồng, huyện Lý Nhân, tỉnh Hà Nam Ninh",1982,1989
6384,Đào Ngọc Dung,,"Ủy viên Ban Chấp hành Tỉnh đoàn, Phó Trưởng Ban Công tác thiếu nhi, Tỉnh đoàn Hà Nam Ninh",1989,1990
6385,Đào Ngọc Dung,,"Ủy viên Ban Thường vụ Tỉnh đoàn, Trưởng Ban Tổ chức - Kiểm tra Tỉnh đoàn Hà Nam Ninh rồi tỉnh Nam Hà (sau tách tỉnh); Phó Bí thư Thường trực Tỉnh đoàn, Ủy viên Ban Chấp hành Đảng bộ tỉnh Nam Hà khóa IV; Ủy viên Ban Chấp hành Trung ương Đoàn, Đại biểu Hội đồng nhân dân tỉnh Nam Hà",1990,1992
6386,Đào Ngọc Dung,,"Ủy viên Ban Chấp hành Đảng bộ tỉnh, Ủy viên Ban Chấp hành Trung ương Đoàn, Bí thư Tỉnh đoàn Nam Hà, Đại biểu Hội đồng nhân dân, Phó Trưởng Ban Văn hóa - Xã hội Hội đồng nhân dân tỉnh Nam Hà, Phó Chủ nhiệm Ủy ban Thanh niên tỉnh Nam Hà, Phó Chủ nhiệm Ủy ban Bảo vệ, chăm sóc và giáo dục thiếu niên nhi đồng tỉnh Nam Hà",4/1992,5/1996
6387,Đào Ngọc Dung,,"Ủy viên Ban Thường vụ Tỉnh ủy, Trưởng Ban Dân vận Tỉnh ủy Nam Hà, Trưởng Ban Văn hóa - Xã hội, Hội đồng nhân dân tỉnh Nam Hà",5/1996,11/1996
6388,Đào Ngọc Dung,,"Bộ Chính trị điều động về công tác tại Trung ương Đoàn, tham gia Ban Thường vụ Trung ương Đoàn, Chủ tịch Hội đồng đội Trung ương, Trưởng Ban Công tác thiếu nhi",11/1996,11/1997
6389,Đào Ngọc Dung,,"Bí thư Trung ương Đoàn khóa VII, Chủ tịch Hội đồng đội Trung ương",11/1997,12/2002
6390,Đào Ngọc Dung,,Bí thư Thường trực Trung ương Đoàn khóa VIII,01/2003,3/2005
6391,Đào Ngọc Dung,,Quyền Bí thư thứ nhất rồi Bí thư thứ nhất Trung ương Đoàn thanh niên Cộng sản Hồ Chí Minh,4/2005,01/2007
6392,Đào Ngọc Dung,,"Tại Đại hội Đại biểu toàn quốc lần thứ X của Đảng, được bầu vào Ban Chấp hành Trung ương Đảng",,
6393,Đào Ngọc Dung,,"Chủ nhiệm Ủy ban Quốc gia về Thanh niên Việt Nam; Bí thư Đảng ủy Cơ quan Trung ương Đoàn, Ủy viên Ban Chấp hành Đảng bộ Khối Dân vận Trung ương",,
6394,Đào Ngọc Dung,,"Ủy viên Trung ương Đảng khóa X, Bí thư Ban cán sự đảng Ngoài nước",02/2007,8/2007
6395,Đào Ngọc Dung,,"Ủy viên Trung ương Đảng khóa X, Phó Trưởng Ban Thường trực Ban Chỉ đạo Tây Bắc",8/2007,5/2010
6396,Đào Ngọc Dung,,"Ủy viên Trung ương Đảng khóa X, Phó Bí thư Thường trực Tỉnh ủy rồi Bí thư Tỉnh ủy, Chủ tịch Hội đồng nhân dân tỉnh Yên Bái",5/2010,8/2011
6397,Đào Ngọc Dung,,"Tại Đại hội Đại biểu toàn quốc lần thứ XI của Đảng, được bầu tái cử vào Ban Chấp hành Trung ương Đảng",,
6398,Đào Ngọc Dung,,"Ủy viên Trung ương Đảng khóa XI, Bí thư Đảng ủy Khối các Cơ quan Trung ương",8/2011,4/2016
6399,Đào Ngọc Dung,,"Tại Đại hội Đại biểu toàn quốc lần thứ XII của Đảng, được bầu tái cử vào Ban Chấp hành Trung ương Đảng",,
6400,Đào Ngọc Dung,,"Ủy viên Trung ương Đảng khóa XII, Bí thư Ban Cán sự đảng, Bộ trưởng Bộ Lao động - Thương binh và Xã hội; Đại biểu Quốc hội khóa XIV, XV",4/2016,02/2025
6401,Đào Ngọc Dung,,"Tại Đại hội đại biểu toàn quốc lần thứ XIII của Đảng, được bầu lại vào Ban Chấp hành Trung ương Đảng",,
